{
  "jobId": "e2e-mixed-1",
  "edlId": "01KZ08ZJ8MGTRS8XE919GKWHME",
  "recordedModelPath": "C:/projects/ai.playground/trendMonitor/cutdown/skills/validate/fixtures/e2e/recorded-critic.json",
  "boundsPath": null,
  "styleProfilePath": "C:/projects/ai.playground/trendMonitor/cutdown/data/style-profiles/acct-social-soup-001.yaml"
}